{
  "schema": "hearthline-plays.objective-window.v1",
  "fixture_kind": "WHOLLY_SYNTHETIC_STRUCTURE_ONLY",
  "status": "PREPARED_NOT_RUN_STATIC_VALIDATED",
  "claim_ceiling": "This fabricated A/B/C lifecycle is validated only as static structure by the offline verifier. It is not a hosted-workspace keepalive test, scheduler test, model run, ARC interaction, Kaggle interaction, task-success result, or authority receipt.",
  "window": {
    "window_id": "synthetic-objective-window-0001",
    "controller_ref": "SYNTHETIC_CONTROLLER_0001",
    "external_operator_control_ref": "UNBOUND",
    "effect_admission_ref": "SYNTHETIC_CONTROLLER_0001",
    "effect_executor_ref": "UNBOUND",
    "terminal_authority_source_ref": "UNBOUND",
    "accepts_new_objectives_while_another_is_suspended": true,
    "completion_order_may_differ_from_open_order": true,
    "heartbeat_semantics": "INTERRUPT_AND_CHECKPOINT_RECEIPT_ONLY",
    "heartbeat_is_keepalive": false,
    "heartbeat_is_scheduler": false
  },
  "objectives": [
    {
      "objective_id": "synthetic-objective-a",
      "spark_or_creature_ref": "SYNTHETIC_SPARK_A",
      "scope_ref": "SYNTHETIC_SCOPE_A",
      "grant_ref": "SYNTHETIC_NONAUTHORITATIVE_GRANT_FIXTURE_A",
      "budget_ref": "SYNTHETIC_BUDGET_A",
      "ledger_ref": "SYNTHETIC_LEDGER_A",
      "heartbeat_ref": "SYNTHETIC_HEARTBEAT_A",
      "homecoming_ref": "SYNTHETIC_HOMECOMING_A",
      "evaluation_rule_ref": "SYNTHETIC_RULE_A"
    },
    {
      "objective_id": "synthetic-objective-b",
      "spark_or_creature_ref": "SYNTHETIC_SPARK_B",
      "scope_ref": "SYNTHETIC_SCOPE_B",
      "grant_ref": "SYNTHETIC_NONAUTHORITATIVE_GRANT_FIXTURE_B",
      "budget_ref": "SYNTHETIC_BUDGET_B",
      "ledger_ref": "SYNTHETIC_LEDGER_B",
      "heartbeat_ref": "SYNTHETIC_HEARTBEAT_B",
      "homecoming_ref": "SYNTHETIC_HOMECOMING_B",
      "evaluation_rule_ref": "SYNTHETIC_RULE_B"
    },
    {
      "objective_id": "synthetic-objective-c",
      "spark_or_creature_ref": "SYNTHETIC_SPARK_C",
      "scope_ref": "SYNTHETIC_SCOPE_C",
      "grant_ref": "SYNTHETIC_NONAUTHORITATIVE_GRANT_FIXTURE_C",
      "budget_ref": "SYNTHETIC_BUDGET_C",
      "ledger_ref": "SYNTHETIC_LEDGER_C",
      "heartbeat_ref": "SYNTHETIC_HEARTBEAT_C",
      "homecoming_ref": "SYNTHETIC_HOMECOMING_C",
      "evaluation_rule_ref": "SYNTHETIC_RULE_C"
    }
  ],
  "events": [
    {
      "sequence": 1,
      "event": "OPEN_OBJECTIVE",
      "objective_id": "synthetic-objective-a",
      "scope_ref": "SYNTHETIC_SCOPE_A",
      "grant_ref": "SYNTHETIC_NONAUTHORITATIVE_GRANT_FIXTURE_A",
      "budget_ref": "SYNTHETIC_BUDGET_A",
      "ledger_ref": "SYNTHETIC_LEDGER_A",
      "heartbeat_ref": "SYNTHETIC_HEARTBEAT_A",
      "homecoming_ref": "SYNTHETIC_HOMECOMING_A",
      "evaluation_rule_ref": "SYNTHETIC_RULE_A",
      "controller_ref": "SYNTHETIC_CONTROLLER_0001",
      "lifecycle_receipt_ref": "SYNTHETIC_WINDOW_EVENT_0001",
      "checkpoint_receipt_ref": null,
      "homecoming_custody_state": "HOMECOMING:NOT_STARTED",
      "objective_disposition": "OBJECTIVE:ACTIVE",
      "external_effect_receipt_ref": null
    },
    {
      "sequence": 2,
      "event": "SUSPEND_OBJECTIVE",
      "objective_id": "synthetic-objective-a",
      "scope_ref": "SYNTHETIC_SCOPE_A",
      "grant_ref": "SYNTHETIC_NONAUTHORITATIVE_GRANT_FIXTURE_A",
      "budget_ref": "SYNTHETIC_BUDGET_A",
      "ledger_ref": "SYNTHETIC_LEDGER_A",
      "heartbeat_ref": "SYNTHETIC_HEARTBEAT_A",
      "homecoming_ref": "SYNTHETIC_HOMECOMING_A",
      "evaluation_rule_ref": "SYNTHETIC_RULE_A",
      "controller_ref": "SYNTHETIC_CONTROLLER_0001",
      "lifecycle_receipt_ref": "SYNTHETIC_WINDOW_EVENT_0002",
      "checkpoint_receipt_ref": "SYNTHETIC_SUSPENSION_A_0001",
      "homecoming_custody_state": "HOMECOMING:NOT_STARTED",
      "objective_disposition": "OBJECTIVE:SUSPENDED",
      "external_effect_receipt_ref": null
    },
    {
      "sequence": 3,
      "event": "OPEN_OBJECTIVE",
      "objective_id": "synthetic-objective-b",
      "scope_ref": "SYNTHETIC_SCOPE_B",
      "grant_ref": "SYNTHETIC_NONAUTHORITATIVE_GRANT_FIXTURE_B",
      "budget_ref": "SYNTHETIC_BUDGET_B",
      "ledger_ref": "SYNTHETIC_LEDGER_B",
      "heartbeat_ref": "SYNTHETIC_HEARTBEAT_B",
      "homecoming_ref": "SYNTHETIC_HOMECOMING_B",
      "evaluation_rule_ref": "SYNTHETIC_RULE_B",
      "controller_ref": "SYNTHETIC_CONTROLLER_0001",
      "lifecycle_receipt_ref": "SYNTHETIC_WINDOW_EVENT_0003",
      "checkpoint_receipt_ref": null,
      "homecoming_custody_state": "HOMECOMING:NOT_STARTED",
      "objective_disposition": "OBJECTIVE:ACTIVE",
      "external_effect_receipt_ref": null
    },
    {
      "sequence": 4,
      "event": "OPEN_OBJECTIVE",
      "objective_id": "synthetic-objective-c",
      "scope_ref": "SYNTHETIC_SCOPE_C",
      "grant_ref": "SYNTHETIC_NONAUTHORITATIVE_GRANT_FIXTURE_C",
      "budget_ref": "SYNTHETIC_BUDGET_C",
      "ledger_ref": "SYNTHETIC_LEDGER_C",
      "heartbeat_ref": "SYNTHETIC_HEARTBEAT_C",
      "homecoming_ref": "SYNTHETIC_HOMECOMING_C",
      "evaluation_rule_ref": "SYNTHETIC_RULE_C",
      "controller_ref": "SYNTHETIC_CONTROLLER_0001",
      "lifecycle_receipt_ref": "SYNTHETIC_WINDOW_EVENT_0004",
      "checkpoint_receipt_ref": null,
      "homecoming_custody_state": "HOMECOMING:NOT_STARTED",
      "objective_disposition": "OBJECTIVE:ACTIVE",
      "external_effect_receipt_ref": null
    },
    {
      "sequence": 5,
      "event": "RETURN_OBJECTIVE",
      "objective_id": "synthetic-objective-c",
      "scope_ref": "SYNTHETIC_SCOPE_C",
      "grant_ref": "SYNTHETIC_NONAUTHORITATIVE_GRANT_FIXTURE_C",
      "budget_ref": "SYNTHETIC_BUDGET_C",
      "ledger_ref": "SYNTHETIC_LEDGER_C",
      "heartbeat_ref": "SYNTHETIC_HEARTBEAT_C",
      "homecoming_ref": "SYNTHETIC_HOMECOMING_C",
      "evaluation_rule_ref": "SYNTHETIC_RULE_C",
      "controller_ref": "SYNTHETIC_CONTROLLER_0001",
      "lifecycle_receipt_ref": "SYNTHETIC_WINDOW_EVENT_0005",
      "checkpoint_receipt_ref": null,
      "homecoming_custody_state": "HOMECOMING:RECONCILED",
      "objective_disposition": "SYNTHETIC_RULE_C:SATISFIED",
      "external_effect_receipt_ref": null
    },
    {
      "sequence": 6,
      "event": "RETURN_OBJECTIVE",
      "objective_id": "synthetic-objective-b",
      "scope_ref": "SYNTHETIC_SCOPE_B",
      "grant_ref": "SYNTHETIC_NONAUTHORITATIVE_GRANT_FIXTURE_B",
      "budget_ref": "SYNTHETIC_BUDGET_B",
      "ledger_ref": "SYNTHETIC_LEDGER_B",
      "heartbeat_ref": "SYNTHETIC_HEARTBEAT_B",
      "homecoming_ref": "SYNTHETIC_HOMECOMING_B",
      "evaluation_rule_ref": "SYNTHETIC_RULE_B",
      "controller_ref": "SYNTHETIC_CONTROLLER_0001",
      "lifecycle_receipt_ref": "SYNTHETIC_WINDOW_EVENT_0006",
      "checkpoint_receipt_ref": null,
      "homecoming_custody_state": "HOMECOMING:RECONCILED",
      "objective_disposition": "SYNTHETIC_RULE_B:SATISFIED",
      "external_effect_receipt_ref": null
    },
    {
      "sequence": 7,
      "event": "RESUME_OBJECTIVE",
      "objective_id": "synthetic-objective-a",
      "scope_ref": "SYNTHETIC_SCOPE_A",
      "grant_ref": "SYNTHETIC_NONAUTHORITATIVE_GRANT_FIXTURE_A",
      "budget_ref": "SYNTHETIC_BUDGET_A",
      "ledger_ref": "SYNTHETIC_LEDGER_A",
      "heartbeat_ref": "SYNTHETIC_HEARTBEAT_A",
      "homecoming_ref": "SYNTHETIC_HOMECOMING_A",
      "evaluation_rule_ref": "SYNTHETIC_RULE_A",
      "controller_ref": "SYNTHETIC_CONTROLLER_0001",
      "lifecycle_receipt_ref": "SYNTHETIC_WINDOW_EVENT_0007",
      "checkpoint_receipt_ref": "SYNTHETIC_RESUME_A_0001",
      "homecoming_custody_state": "HOMECOMING:NOT_STARTED",
      "objective_disposition": "OBJECTIVE:ACTIVE",
      "external_effect_receipt_ref": null
    },
    {
      "sequence": 8,
      "event": "RETURN_OBJECTIVE",
      "objective_id": "synthetic-objective-a",
      "scope_ref": "SYNTHETIC_SCOPE_A",
      "grant_ref": "SYNTHETIC_NONAUTHORITATIVE_GRANT_FIXTURE_A",
      "budget_ref": "SYNTHETIC_BUDGET_A",
      "ledger_ref": "SYNTHETIC_LEDGER_A",
      "heartbeat_ref": "SYNTHETIC_HEARTBEAT_A",
      "homecoming_ref": "SYNTHETIC_HOMECOMING_A",
      "evaluation_rule_ref": "SYNTHETIC_RULE_A",
      "controller_ref": "SYNTHETIC_CONTROLLER_0001",
      "lifecycle_receipt_ref": "SYNTHETIC_WINDOW_EVENT_0008",
      "checkpoint_receipt_ref": null,
      "homecoming_custody_state": "HOMECOMING:RECONCILED",
      "objective_disposition": "SYNTHETIC_RULE_A:SATISFIED",
      "external_effect_receipt_ref": null
    },
    {
      "sequence": 9,
      "event": "CLOSE_AGGREGATE_RESPONSE",
      "objective_id": null,
      "scope_ref": null,
      "grant_ref": null,
      "budget_ref": null,
      "ledger_ref": null,
      "heartbeat_ref": null,
      "homecoming_ref": null,
      "evaluation_rule_ref": null,
      "controller_ref": "SYNTHETIC_CONTROLLER_0001",
      "lifecycle_receipt_ref": "SYNTHETIC_WINDOW_EVENT_0009",
      "checkpoint_receipt_ref": null,
      "homecoming_custody_state": null,
      "objective_disposition": null,
      "external_effect_receipt_ref": null
    }
  ],
  "objective_set": {
    "snapshot_ref": "SYNTHETIC_OBJECTIVE_SET_0001",
    "expected_objective_ids": [
      "synthetic-objective-a",
      "synthetic-objective-b",
      "synthetic-objective-c"
    ],
    "return_order": [
      "synthetic-objective-c",
      "synthetic-objective-b",
      "synthetic-objective-a"
    ],
    "final_states": [
      {
        "objective_id": "synthetic-objective-a",
        "homecoming_custody_state": "HOMECOMING:RECONCILED",
        "objective_disposition": "SYNTHETIC_RULE_A:SATISFIED"
      },
      {
        "objective_id": "synthetic-objective-b",
        "homecoming_custody_state": "HOMECOMING:RECONCILED",
        "objective_disposition": "SYNTHETIC_RULE_B:SATISFIED"
      },
      {
        "objective_id": "synthetic-objective-c",
        "homecoming_custody_state": "HOMECOMING:RECONCILED",
        "objective_disposition": "SYNTHETIC_RULE_C:SATISFIED"